Lieu : Mnémonique;Programme : Code;Programme : Libellé;Programme : Etat;Programme : Date de création;Programme : Droit : Personne : Responsable : NOM Prénom : Liste
126-P-013;CHIMIE_ECHPASS_DGT;Suivi des contaminants chimiques (métaux) par échantillonneurs passifs DGT;Actif;18/07/2013;AMOUROUX Isabelle|DESTISON Leo|DUVAL Magali|LE ROUX Alois|MAUREL Laurence|MUNARON Dominique|NOGUES Christophe
126-P-006;CHIMIE_ECHPASS_POCIS;Suivi des contaminants chimiques par échantillonneurs passifs POCIS;Actif;18/07/2013;AMOUROUX Isabelle|CIMITERRA Nicolas|DESTISON Leo|DUVAL Magali|LE ROUX Alois|MAUREL Laurence|MUNARON Dominique|NOGUES Christophe
126-P-013;CHIMIE_ECHPASS_SBSE;Suivi des contaminants chimiques par échantillonneurs passifs SBSE;Actif;18/07/2013;AMOUROUX Isabelle|DESTISON Leo|DUVAL Magali|LE ROUX Alois|MAUREL Laurence|MUNARON Dominique|NOGUES Christophe
126-S-356;CONSTRUI_RUN_PA_POISSONS;Projet CONSTRUI Réunion - Parcours aléatoire poissons;Actif;18/06/2024;DUVAL Magali|MAUREL Laurence|RUNGASSAMY Tevamie
126-S-356;DECHETS_FLOTTANTS_MICROPLASTIQUE_REUNION;Programme de surveillance Microplastiques Flottants à la Réunion;Actif;07/01/2022;DUVAL Magali|MAUREL Laurence|TURQUET Jean
126-S-356;DECHETS_FLOTTANTS_REUNION;Programme de surveillance Macrodéchets Flottants à la Réunion;Actif;19/09/2023;DUVAL Magali|MAUREL Laurence
126-P-534;DECHETS_FOND_PLONGEE_REUNION;Programme de surveillance des macrodéchets sur les récifs coralliens à la Réunion;Actif;07/01/2022;DUVAL Magali|MAUREL Laurence
126-L-486;DECHETS_PLAGES_REUNION;Programme de surveillance des déchets sur les plages à la Réunion;Actif;06/01/2022;DUVAL Magali|MAUREL Laurence|TURQUET Jean
126-P-479;DECHETS_SEDIMENTS_MICROPLASTIQUES_ROCCH;ROCCH sédiment - volet Microplastiques;Actif;24/06/2024;GROUHEL-PELLOUIN Anne
126-P-400;EFFET-RESERVE_LAREUNION_BELT_POISSON;Suivi de l'effet de la Réserve Marine Réunion sur les poissons (BELT);Actif;04/11/2020;DUVAL Magali|MAUREL Laurence|RUNGASSAMY Tevamie
126-P-026;EFFET-RESERVE_LAREUNION_PA_BENTHOS;Suivi de l'effet de la Réserve Marine Réunion sur le corail (PA);Actif;10/11/2020;CAUVIN Bruce|DUVAL Magali|MAUREL Laurence|RUNGASSAMY Tevamie
126-P-034;EFFET-RESERVE_LAREUNION_PA_POISSON;Suivi de l'effet de la Réserve Marine Réunion sur les poissons (PA);Actif;04/11/2020;DUVAL Magali|MAUREL Laurence|RUNGASSAMY Tevamie
126-P-403;EFFET-RESERVE_LAREUNION_PHOTOQ_BENTHOS;Suivi de l'effet réserve sur la communauté benthique à travers les photoquadrats (CPCe);Actif;05/04/2024;CAUVIN Bruce|DUVAL Magali|MAUREL Laurence|RUNGASSAMY Tevamie
126-P-553;EI_RUN_BASSIN_GRANDE-ANSE_BELT_POISSON;Etude d'impact de l'extension du bassin de Grande-Anse - Belt Poisson;Actif;30/05/2024;DUVAL Magali|MAUREL Laurence
126-P-553;EI_RUN_BASSIN_GRANDE-ANSE_LIT_BENTHOS;Etude d'impact de l'extension du bassin de Grande-Anse - LIT Benthos;Actif;30/05/2024;DUVAL Magali|MAUREL Laurence
126-P-223;EI_RUN_BEAUFONDS_LIT_BENTHOS;Etude d'impact du rejet de la distillerie de La Rivière du Mât - La Réunion - LIT Benthos;Actif;23/04/2019;DUVAL Magali|MAUREL Laurence
126-P-220;EI_RUN_BEAUFONDS_PCS_BENTHOS;Etude d'impact du rejet de la distillerie de La Rivière du Mât - La Réunion - suivis PCS benthos;Actif;13/05/2019;DUVAL Magali|MAUREL Laurence
126-P-219;EI_RUN_BEAUFONDS_PCS_POISSON;Etude d'impact du rejet de la distillerie de La Rivière du Mât - La Réunion - suivis PCS poissons;Actif;23/04/2019;DUVAL Magali|MAUREL Laurence
126-P-032;EI_RUN_BLANCHISSEMENT_PCS_BENTHOS;Etude d'impact du blanchissement sur les peuplements coralliens - La Réunion - protocole PCS;Actif;18/05/2021;DUVAL Magali|MAUREL Laurence
126-P-337;EI_RUN_BOUCAN_PCS_POISSON;Contrôle environnemental des travaux de réhabilitation du bassin de baignade de Boucan Canot;Actif;08/02/2019;DUVAL Magali|MAUREL Laurence
126-P-127;EI_RUN_DRAGAGE_STPIERRE_BELT_INVERT; Etude d'impact du dragage du port de Saint-Pierre - La Réunion - BELT Invertébré;Actif;13/04/2023;DUVAL Magali|MAUREL Laurence
126-P-512;EI_RUN_DRAGAGE_STPIERRE_BELT_POISSON; Etude d'impact du dragage du port de Saint-Pierre - La Réunion - BELT Poisson;Actif;13/04/2023;DUVAL Magali|MAUREL Laurence
126-P-127;EI_RUN_DRAGAGE_STPIERRE_LIT_BENTHOS; Etude d'impact du dragage du port de Saint-Pierre - La Réunion - LIT Benthos;Actif;13/04/2023;DUVAL Magali|MAUREL Laurence
126-S-389;EI_RUN_DRAGAGE_TERRITOIRE-OUEST;Etude d'impact du dragage des ports du Terrtitoire de l'Ouest de La Réunion;Actif;12/05/2025;DUVAL Magali|LE ROUX Alois|MAUREL Laurence
126-P-176;EI_RUN_GRAND-PORT;SDPN du GPMDLR - suivis autres thématiques que récif corallien;Actif;12/07/2024;DUVAL Magali|LE ROUX Alois|MAUREL Laurence
126-P-157;EI_RUN_GRAND-PORT_BELT_INVERT;SDPN du GPMDLR - suivi invertébré - protocole Belt;Actif;22/08/2017;DUVAL Magali|MAUREL Laurence
126-P-151;EI_RUN_GRAND-PORT_BELT_POISSON;SDPN du GPMDLR - suivi poisson - protocole Belt;Actif;04/07/2017;DUVAL Magali|MAUREL Laurence
126-P-148;EI_RUN_GRAND-PORT_LIT_BENTHOS;SDPN du GPMDLR - suivi benthos - protocole LIT;Actif;04/07/2017;DUVAL Magali|MAUREL Laurence
126-P-148;EI_RUN_GRAND-PORT_PARCOURS_ALEATOIRE;SDPN du GPMDLR - suivi de la biodiversité récifale - protocole parcours aléatoire;Actif;05/09/2017;DUVAL Magali|MAUREL Laurence
126-P-173;EI_RUN_GRAND-PORT_PCS_BENTHOS;SDPN du GPMDLR -  suivi benthos - protocole point fixe;Actif;05/09/2017;DUVAL Magali|MAUREL Laurence
126-P-173;EI_RUN_GRAND-PORT_PCS_INVERT;SDPN du GPMDLR - suivi invertébré - protocole point fixe;Actif;05/09/2017;DUVAL Magali|MAUREL Laurence
126-P-171;EI_RUN_GRAND-PORT_PCS_POISSON;SDPN du GPMDLR - suivi poisson - protocole point fixe;Actif;05/09/2017;DUVAL Magali|MAUREL Laurence
126-P-172;EI_RUN_GRAND-PORT_PHOTOQUADRAT_BENTHOS;SDPN du GPMDLR - suivi benthos - protocole photoquadrats;Actif;13/11/2023;DUVAL Magali|MAUREL Laurence
126-P-198;EI_RUN_KELONIA;Suivi du rejet du centre Kelonia - suivis autres thématiques que récif corallien;Actif;05/07/2023;DUVAL Magali|LE ROUX Alois|MAUREL Laurence
126-P-201;EI_RUN_KELONIA_BELT_POISSON;Suivi du rejet du centre Kelonia - suivi poisson - protocole Belt;Actif;06/09/2018;DUVAL Magali|MAUREL Laurence
126-P-201;EI_RUN_KELONIA_LIT_BENTHOS;Suivi du rejet du centre Kelonia - suivi benthos - protocole LIT;Actif;06/09/2018;DUVAL Magali|MAUREL Laurence
126-P-372;EI_RUN_NRL_PCS_POISSON;Etude d'impact du chantier de la Nouvelle Route du Littoral - suivi poisson sur point fixe;Actif;16/10/2019;DUVAL Magali|MAUREL Laurence
126-P-374;EI_RUN_NRL_PHOTOQUADRAT_BENTHOS;Etude d'impact du chantier de la Nouvelle Route du Littoral - suivi benthos Photoquadrats;Actif;16/10/2019;DUVAL Magali|MAUREL Laurence
126-P-144;EI_RUN_RAVINE_BLANCHE_BELT_POISSON;Etude d'impact de l'aménagement de la Ravine Blanche - suivi;Gelé;16/05/2017;DUVAL Magali|MAUREL Laurence
126-P-142;EI_RUN_RAVINE_BLANCHE_LIT_BENTHOS;Etude d'impact de l'aménagement de la Ravine Blanche - suivi;Gelé;16/05/2017;DUVAL Magali|MAUREL Laurence
126-P-358;EI_RUN_SAVANNA_PCS_POISSON;Etude d'impact distillerie Savanna Réunion - PCS Poissons;Actif;18/06/2019;DUVAL Magali|MAUREL Laurence
126-P-431;EI_RUN_STEU_CAMBAIE_PA_POISSON;Etude d'impact de la Station de Traitement des Eaux Usées de Cambaie - Parcours aléatoire poissons;Actif;02/12/2020;DUVAL Magali|MAUREL Laurence
126-P-431;EI_RUN_STEU_CAMBAIE_QUADRAT_BENTHOS;Etude d'impact de la Station de Traitement des Eaux Usées de Cambaie - Quadrats benthos;Actif;02/12/2020;DUVAL Magali|MAUREL Laurence
126-P-354;EI_RUN_STEU_ERMITAGE_BELT_INVERT;Etude d'impact de la Station de Traitement des Eaux Usées de L'Ermitage;Actif;20/02/2019;DUVAL Magali|MAUREL Laurence
126-P-346;EI_RUN_STEU_ERMITAGE_BELT_POISSON;Etude d'impact de la Station de Traitement des Eaux Usées de L'Ermitage;Actif;20/02/2019;DUVAL Magali|MAUREL Laurence
126-P-140;EI_RUN_STEU_ST_JOSEPH_BELT_POISSON;Etude d'impact de la station d'épuration de Saint-Joseph;Actif;08/06/2017;DUVAL Magali|MAUREL Laurence
126-P-140;EI_RUN_STEU_ST_JOSEPH_LIT_BENTHOS;Etude d'impact de la station d'épuration de Saint-Joseph;Actif;08/06/2017;DUVAL Magali|MAUREL Laurence
126-P-127;EI_RUN-ST-PIERRE_QUADRAT_BLANCHISSEMENT;Etude d'impact du Blanchissement corallien à Saint-Pierre;Actif;06/04/2018;DUVAL Magali|MAUREL Laurence
126-P-093;ETUDE_PROSPECTIVE_DCE_2012;Etude Prospective DCE 2012 (campagne exceptionnelle);Gelé;29/03/2012;LE MOIGNE Morgan
126-P-028;GCRMN_LAREUNION_BELT_INVERT;GCRMN Ile de La Réunion - suivis Belt des invertébrés;Actif;30/09/2015;DUVAL Magali|MAUREL Laurence|RUNGASSAMY Tevamie
126-P-125;GCRMN_LAREUNION_BELT_POISSONS;GCRMN Ile de La Réunion - suivis Belt des poissons;Actif;30/09/2015;DUVAL Magali|MAUREL Laurence|RUNGASSAMY Tevamie
126-P-038;GCRMN_LAREUNION_LIT_BENTHOS;GCRMN Ile de La Réunion - suivis LIT du benthos;Actif;30/09/2015;CAUVIN Bruce|DUVAL Magali|MAUREL Laurence|RUNGASSAMY Tevamie
126-P-039;GCRMN_LAREUNION_QUADRAT_BENTHOS;GCRMN Ile de La Réunion - suivis Quadrats du benthos;Actif;07/10/2015;BIGOT Lionel|CAUVIN Bruce|DUVAL Magali|MAUREL Laurence|RUNGASSAMY Tevamie
126-P-562;GCRMN_RUN-SUD_BELT_INVERT;GCRMN stations Sud - suivi des invertébrés par belt transect;Actif;16/09/2024;DUVAL Magali|MAUREL Laurence
126-P-563;GCRMN_RUN-SUD_BELT_POISSONS;GCRMN stations Sud - suivi des poissons par belt transect;Actif;16/09/2024;DUVAL Magali|MAUREL Laurence
126-P-562;GCRMN_RUN-SUD_LIT_BENTHOS;GCRMN stations Sud - suivi du corail par LIT transect;Actif;16/09/2024;DUVAL Magali|MAUREL Laurence
126-P-020;LA_REUNION_ETUDES_DIVERSES;Données relatives à des études et travaux de recherche hors surveillance et réglementaire;Actif;17/05/2013;DUVAL Magali|LE ROUX Alois|MAUREL Laurence
126-P-185;LA_REUNION_ETUDES_IMPACT;Etudes d'impact à la Réunion;Actif;19/02/2013;DUVAL Magali|LE ROUX Alois|MAUREL Laurence
126-P-118;LA_REUNION_STEU;Suivi des rejets urbains : Stations d'Epuration Urbaine à la Réunion;Actif;19/02/2013;DUVAL Magali|LE ROUX Alois|MAUREL Laurence
126-S-356;MANTATOW_LAREUNION_BELT_POISSON;Suivi du peuplement ichtyologique des récifs coralliens de La Réunion - protocole Manta-Tow;Actif;17/04/2023;DUVAL Magali|MAUREL Laurence|MULOCHAU Thierry
126-S-023;MSA_LAREUNION_BENTHOS;Suivi des récifs coralliens de La Réunion - protocole MSA;Actif;21/02/2017;DUVAL Magali|MAUREL Laurence
126-P-327;PAPI_LAREUNION_LIT_BENTHOS;PAPI_Saint-Paul & Trois-Bassins - suivi récifs - protocole LIT;Actif;28/01/2019;DUVAL Magali|MAUREL Laurence
126-P-178;PAPI_LAREUNION_OUEST;PAPI_Saint-Paul & Trois-Bassins - suivis autres thématiques que récif et herbier;Actif;15/07/2024;DUVAL Magali|LE ROUX Alois|MAUREL Laurence
126-P-028;PAPI_LAREUNION_PIT_BENTHOS;PAPI_Saint-Paul & Trois-Bassins - suivi récifs - protocole PIT;Actif;28/01/2019;DUVAL Magali|MAUREL Laurence
126-P-329;PAPI_LAREUNION_QUADRAT_HERBIERS;PAPI_Saint-Paul & Trois-Bassins  - suivi herbiers - protocole Quadrat;Actif;29/01/2019;DUVAL Magali|MAUREL Laurence
126-P-295;POPMER_LAREUNION_BELT_POISSON;POPulation d'Epinephelus MERra récifs réunion - BELT Poissons;Actif;14/01/2019;DUVAL Magali|MAUREL Laurence|RUNGASSAMY Tevamie
126-P-250;POPMER_LAREUNION_LIT_BENTHOS;POPulation d'Epinephelus MERra récifs réunion - LIT Benthos;Actif;14/01/2019;DUVAL Magali|MAUREL Laurence|RUNGASSAMY Tevamie
126-P-071;REBENT_FAU;REBENT Stationnel Macrofaune;Actif;18/05/2009;DUVAL Magali|FOVEAU Aurelie|LE ROUX Alois|MAUREL Laurence
126-P-013;REPHY;REPHY Phytoplancton et Physico-Chimie;Actif;05/06/2008;DUVAL Magali|FATRAS Lucas|GAUTHIER Emilie|LE MOIGNE Morgan|LE ROUX Alois|LEMOINE Maud|MANACH Soazig|MAUREL Laurence|NEAUD-MASSON Nadine
126-P-034;REPHY-ETUDES;REPHY Etudes Phytoplancton Hydrologie - hors cadre REPHY Observation ou Surveillance;Actif;15/02/2016;DANIELOU Marie-Madeleine|DERRIEN Amelie|DUVAL Magali|LE MOIGNE Morgan|LEMOINE Maud|MAUREL Laurence|NEAUD-MASSON Nadine
126-P-024;REPOMO;REPOM hydrologie;Gelé;05/06/2008;EL FADILI Mohamed|FATRAS Lucas
126-P-115;REPOMS;REPOM sédiment;Actif;05/06/2008;DROIT Julie|DUVAL Magali|EL FADILI Mohamed|MAUREL Laurence
126-P-012;RINBIO;Réseau Intégrateur Biologique;Actif;05/06/2008;BRODU Nicolas|DUVAL Magali|HERLORY Olivier|TOMASINO Corinne
126-P-003;RNOHYD;RNO Hydrologie;Actif;05/06/2008;GROUHEL-PELLOUIN Anne
126-S-393;RNOMV;RNO Matière Vivante puis ROCCH Matière Vivante;Actif;05/06/2008;GROUHEL-PELLOUIN Anne
126-P-074;RNOSED;RNO puis ROCCH sédiment;Actif;05/06/2008;GROUHEL-PELLOUIN Anne
126-P-014;ROCCH-ETUDES;Etudes contaminants chimiques - toutes matrices;Actif;04/08/2017;AMOUROUX Isabelle|DUVAL Magali|GROUHEL-PELLOUIN Anne|HERLORY Olivier
126-P-485;ROCCHSED;ROCCH Sédiment;Gelé;14/04/2010;BOUCHOUCHA Marc|DUVAL Magali|GROUHEL-PELLOUIN Anne
126-S-356;SUIVI_LAREUNION_BRUVS_POISSON;Suivis des poissons par BRUVs à La Réunion;Actif;11/09/2019;DUVAL Magali|GADENNE Jean|MAUREL Laurence
126-S-356;SUIVI_LAREUNION_RUMVS_POISSON;Suivis des poissons par RUMVs à La Réunion;Actif;11/09/2019;DUVAL Magali|GADENNE Jean|MAUREL Laurence
126-S-356;SUIVI_LAREUNION_STAVIRO_POISSONS;Suivi des poissons des récifs coralliens réunionnais à l'aide de STAVIRO;Actif;23/05/2019;DUVAL Magali|ROOS David
126-S-356;UTOPIAN_RUN_CORRAM_BENTHOS;Coral Reef Rapid Assessment Method - analyse du benthos de substrats durs;Actif;08/03/2024;DUVAL Magali|MAUREL Laurence
126-S-356;UTOPIAN_RUN_COR-SEARAM_HOLOTHURIES;Coral Reef-Seagrass Rapid Assessment Method - suivi de la population des holothuries;Actif;08/03/2024;DUVAL Magali|MAUREL Laurence
126-S-356;UTOPIAN_RUN_COR-SEARAM_OURSINS;Coral Reef-Seagrass Rapid Assessment Method - suivi de la population d'oursins;Actif;08/03/2024;DUVAL Magali|MAUREL Laurence
126-S-356;UTOPIAN_RUN_COR-SEARAM_PA_POISSONS;Coral Reef-Seagrass Rapid Assessment Method - parcours aléatoire - suivi population de poissons;Actif;08/03/2024;DUVAL Magali|MAUREL Laurence
126-S-356;UTOPIAN_RUN_SEARAM_BENTHOS;Seagrass Rapid Assessment Method - analyse du benthos de substrats meubles;Actif;08/03/2024;DUVAL Magali|MAUREL Laurence
126-S-356;UTOPIAN_RUN_SEARAM_HOLOTHURIE;Seagrass Rapid Assessment Method - suivi de la population des holothuries dans la DAR;Actif;08/03/2024;DUVAL Magali|MAUREL Laurence
